{
  "schemaRevision": 1,
  "kind": "phase0-artifact-approval",
  "subject": {
    "artifactKind": "courseVector",
    "artifactId": "COURSE-VEC-P7-TIMER-001",
    "candidatePath": "expected/courseVector/COURSE-VEC-P7-TIMER-001.json",
    "candidateSha256": "2408a49baba668d53c208eb8b2976680524cc677769c6d22616a28cdaacac74f",
    "candidateAuthor": "codex-phase0-corpus",
    "candidateRevision": 1
  },
  "review": {
    "status": "approved",
    "reviewer": "stone926",
    "reviewedAt": "2026-08-27",
    "reviewRevision": 1
  },
  "integrity": {
    "algorithm": "sha256-canonical-json-v1",
    "envelopeSha256": "2bbc784a3b5476214c181c8f5640dcb2c0e648786e6e10da120626c29ace0030"
  }
}
