{
  "schemaRevision": 1,
  "kind": "phase0-artifact-approval",
  "subject": {
    "artifactKind": "courseVector",
    "artifactId": "COURSE-VEC-P5-DELAY-LINK-001",
    "candidatePath": "expected/courseVector/COURSE-VEC-P5-DELAY-LINK-001.json",
    "candidateSha256": "64927e05b1028da210eefe9daceaf93e7beebab4d1c86a2c546a000228d0e7d9",
    "candidateAuthor": "codex-phase0-corpus",
    "candidateRevision": 1
  },
  "review": {
    "status": "approved",
    "reviewer": "stone926",
    "reviewedAt": "2026-08-27",
    "reviewRevision": 1
  },
  "integrity": {
    "algorithm": "sha256-canonical-json-v1",
    "envelopeSha256": "424658d7b602c21e961530a4b459a97553bd7999f0eba703af706f825de75fb6"
  }
}
